"""The gist of the article 'These Remedies are not Enough', published on 9th June, was given to the court and jury. 9",जून को प्रकाशित लेख “ ये उपाय काफी नहीं हैं ” का सार अदालत और जूरी के समक्ष प्रस्तुत किया गया.,22,21,1,"""इस प्रकार के अन्य उपायों में से एक है जो निम्नलिखित विवरण देता है, यहां तक ​​कि उन्हें अपनी सहमति नहीं देना। इस बात पर चर्चा करने, और उनके लिए आवश्यक सबूत इकट्ठा करना, याद",1.241358473,18.54654111,157.1428571
Here a look at who said what:,आइये जानें किसने क्या कहा:,7,5,2,"अत्यंत विश्वासी हैं लोगों के बीच में से, जो अपना समय पूर्ण कर रहे हैं। उनके दिल में, एक खुशहाल और शांतिपूर्ण परिवार रहता है। वह हमेशा नई चीजें करने के इच्छुक थे। उन्ह",0,11.03356208,680
Khan secured 176 votes while his only rival Sharif got 96 votes.,इमरान खान के पक्ष में 176 वोट पड़े जबकि इमरान के विरोधी शाहबाज शरीफ के पक्ष में सिर्फ 96 वोट पड़े थे.,12,22,10,खन ने अपनी एकमात्र प्रतिद्वंद्वी शारीफ को 96 वोट्स से जीत लिया था।,1.431373614,13.25366865,100
"""The Congress, on the other hand, has fielded Ajay Rai from Varanasi.",वाराणसी से अजय राय को कॉन्ग्रेस ने टिकट दिया है।,12,10,2,"""कांग्रेस के बावजूद, अजय राई से वाराणसी में चुना गया है।""",4.016138436,34.04777762,100
As long as they have to depend on black money and dubious deals to collect their funds we will continue to see the sort of ugly wheeling and dealing we saw on the Tehelka tapes.,"जब तक वे अपना चंदा जुटाने के लिए काले धन और संदिग्ध सौदों पर निर्भर हैं, तब तक हम वैसी घटिया सौदेबाजी देखते रहेंगे, जो तहलका के टेपों में नजर आ रही है.",35,33,2,तलेका टेप्स में दिखाई दे रही है कि वे अपने पैसों से निराश नहीं हैं और उनको धोखाधड़ी करके उन्हें धन इकट्ठा करने के लिए मजबूर करते। हमारे सरकार को यह पता चलना चाहिए,3.555271431,23.57275681,100
He is unwavering when it comes to safeguarding national interests and furthering national progress.,"राष्ट्रहितों के संरक्षण और राष्ट्रीय प्रगति को बढ़ाने की बात हो, तो वह अटल रहे हैं।",14,16,2,वह स्वतंत्र राष्ट्रमित कार्यों और देश में आगे बढ़ने पर विश्वास रखता है।,2.700561757,19.91745499,93.75
PM Modi calls upon international community to unite against terrorism for the sake of humanity,प्रधानमंत्री नरेन्‍द्र मोदी ने अंतर्राष्‍ट्रीय समुदाय से मानवता के हित में आतंकवाद के खिलाफ एकजुट होने का आहवान किया,15,19,4,भारत के प्रधान मंत्री नरेंद्र टोडरा ने अंतर्राष्ट्रीय समुदाय से विरोध करने और दुनिया भर को एकजुट करके आतंकवाद के खिलाफ लड़ने के लिए अपनी बात कही।,7.305891545,52.21412168,110.5263158
"It owes its existence to the Delhi Special Police Establishment Act, 1946.",यह दिल्‍ली विशेष पुलिस स्‍थापना अधिनियम 1946 के अधीन अस्तित्‍व में आई।,12,12,0,"दिल्ली स्पेशल पुलिस एस्टेट act, 1946 के अनुसार यह अपना विकास करता है।",6.754312829,23.49067965,83.33333333
Property registration: Details of registered deeds,संपत्ति का पंजीकरणः पंजीकृत दस्तावेज का विवरण,6,7,1,मालिकता की रजिस्ट्रेशन - मालिकों द्वारा स्थापित निवासी दस्तावेज़,0,22.69619168,128.5714286
"""The film is scheduled to release on February 21, 2020.",मोस्\\u200dट अवेटेड यह फिल्\\u200dम अगले साल 21 फरवरी 2020 को सिनेमाघरों में रिलीज की जाएगी।,10,15,5,"""फिल्म का रिलीज़ दिन २१, २०२० में होने वाली थी।""",1.669427422,11.76616966,93.33333333
"Rajasthan Government has decided to keep close all schools, colleges, coaching centers, gyms, cinemas and theaters etc.","ग्रीस में सभी स्कूल, विश्वविद्यालय, सिनेमाघर, जिम और नाइट क्लब बंद कर दिए गए हैं।",17,15,2,"राजस्थान सरकार ने सभी स्कूलों, कॉलेजों और ट्रेनिंग केंद्रों, गेम्स, फिल्में, थिएटर आदि सहित सभी शिक्षा सुविधाओं पर पूर्ण रूप से बंद करने का निर्धारण किया।",1.94304365,22.73481936,160
What PDP has to say,क्या कहना है बीडीपीओ का,5,5,0,पीडीपी को सुनने वाला है,10.68217516,22.32069143,100
"Wreaths were laid by the Lieutenant General BK Chopra, Director General AFMS and Senior Colonel Commandant and the three Director Generals Medical Service of Army, Navy and Air Force to pay homage to the martyrs.","एएफएमए के महानि‍देशक लेफ्टीनेंट जनरल बी. के. चोपड़ा और वरि‍ष्‍ठ कर्नल कमांडेट तथा सेना, जल सेना और वायु सेना के चि‍कि‍त्‍सा सेवाओं के तीन महानि‍देशकों ने अमर जवान ज्‍योति‍ पर शहीदों को श्रद्धांजलि‍ दीं।",35,34,1,"अर्जनों के लिए विशेष प्रार्थना में शामिल होने, सैन्य बलों और राजनीतिक दलों द्वारा, 1947 तक पहुंचाई गई थी। यहां पर उन्होंने अपनी युद्धपूर्ण भूमि को समर्पित करने के",1.546771204,14.74403179,94.11764706
It is generally presumed that two successive names are teacher and pupil.,यह आम तौर पर माना जाता है कि लगातार दो नाम हैं शिक्षक और छात्र है.,12,16,4,तीनों के लिए शिक्षक और छात्र होना सामान्य मानती जाएगी।,7.756513313,33.3194219,87.5
"After presenting the Kalash , union Minister held a press conference and briefed media about the vision behind this step","कलश सौंपने के बाद, श्री पटेल ने एक प्रेस कॉन्फ्रेंस में इस कदम के पीछे के दृष्टिकोण के बारे में जानकारी दी",20,22,2,"कलाश के बाद, संयुक्त मंत्री ने अपना प्रस्तुति देते हुए समाचार पत्रकारों तक विस्फोटक जानकारी साझा करने और उनको इस पहल पर चर्चा करने के लिए एक अधिकांशतः शुरू कर द",5.51778489,22.56390801,122.7272727
It is a place of magnificent natural beauty and a Hindu pilgrim spot too,यह एक शानदार प्राकृतिक सुंदरता वाला स्‍थल है और एक हिंदू तीर्थ स्‍थल भी है।,14,15,1,यह एक महान प्राकृतिक सुंदरता और हिंदू तीर्थयात्री के लिए भूमि में स्थित है,8.601558512,44.56507164,73.33333333
"""""""Tejashwi is leader of RJD but he is not the leader of the Grand Alliance"""", he said.""","तेजस्वी राजद के नेता, लेकिन महागठबंधन के नेता नहीं हैं।",17,10,7,"""तेजश्वी राजद के नेता है लेकिन ग्रांड अलियन्स में उनका संभावित अध्यक्ष नहीं है।""",10.34360301,41.58957176,100
Olive oil is beneficial for your health in multiple ways.,आंवला स्वास्थ्य के लिए कई तरह से फायदेमंद होता है।,10,10,0,अलोह्यू में स्वास्थ्य के लिए कई तरीकों पर फायदा होता है।,27.90159394,57.19831158,50
WhatsApp Latest Features: This amazing WhatsApp feature will change the style of chatting. know how to use,"WhatsApp में आया नया फीचर, अब muted status को कर सकेंगे हाइड",17,12,5,WhatsApp के नवीनतम विशेषताएँ हैं । यह अनोखा चैटिंग शैली बदल देगा। जानें इसके बारे में।,2.445593937,20.75881418,125
"Similarly and based on media reports, enquiry was initiated in Delhi into issuance of cheques by companies which were alleged to be non-genuine and entry operators.","इसी तरह मीडिया में आई रिपोर्टों को ध्‍यान में रखते हुए दिल्‍ली में भी उन कंपनियों द्वारा चेक जारी किए जाने के मामलों की जांच शुरू की गई थी, जो कथित तौर पर गैर-वास्‍तविक एवं एंट्री ऑपरेटर थीं।",26,38,12,सही और आधार पर मीडिया रिपोर्ट्स के अनुसार दिल्ली से निर्दोष चेक जारी करने वाली कंपनियों सहित लोगों को शामिल करेंगे। इन सभी कानूनी प्रक्रियाओं को ध्यान रखें।,2.466195698,26.72220491,94.73684211
Ajit Pawar while responding to Narendra Modis congratulatory message thanked the Prime Minister.,महाराष्ट्र के उप मुख्यमंत्री अजित पवार ने शपथ लेने के बाद प्रधानमंत्री नरेंद्र मोदी द्वारा दी गई शुभकामनाओं पर शुक्रिया अदा किया है.,13,23,10,"अजित पावर ने नरेंद्र मोदी को अपना संदेश देते हुए, प्रधानमंत्री,  त्योहारों पर मनाए जाने वाले अवसर पर धन्यवाद अदायुक्त।",4.151237743,31.25126184,91.30434783
"""The police who arrested four people.",चार लोगों को गिरफ्तार किया गया है।,6,7,1,"""पुलिस ने चार लोगों को गिरफ्तार कर दिया है।""",24.808415,71.34427767,71.42857143
He later became a legislator.,इसके बाद विधायक भी बने.,5,5,0,लATER वे एक संसद सदस्य बन गए।,0,7.620544482,140
Its objectives are to: -,इसके उद्देश्य हैः,,,0,"अपने उद्देश्यों को प्राप्त करने में मदद करें, जैसे:",0,37.84212364,300
People evacuated as volcano erupts in Indonesia,इंडोनेशिया में ज्वालामुखी विस्फोट के बाद इलाके से लोगों की निकासी जारी,7,12,5,"अन्नपूर्ण विस्फोट के बाद, इंडोनेशिया में लोगों से दूरी बनाने पर प्रशासन ने तीन घंटे तक रुकावट लगाई। 3 घंटे तक शांति रही।",8.010360497,41.56182265,166.6666667
Alcohol is known to all as an inebriant.,एल्कोहल को एक मादक पदार्थ के रूप में जाना जाता है।,8,11,3,अल्कोहल को सभी से जाना है एक मादक।,4.995138898,33.12226692,81.81818182
"""The same goes for Australia versus England semi-final at Edgbaston",इसी के साथ अब ऑस्ट्रेलिया सेमीफाइनल में इंग्लैंड से भिड़ेगी,10,10,0,"""सबी तरह ऑस्ट्रेलिया के खिलाफ इंग्लैंड सेमी-फाइनल में एडीबेसन मैदान पर होना",4.368583926,48.8283315,100
A proposal in this connection is being prepared.,इसके लिए प्रस्ताव तैयार कर लिया गया है।,8,8,0,अतिरिक्त संबंधों के लिए एक प्रस्ताव तैयार कर रहा हूँ।,16.78445963,49.50537977,87.5
Can sinful humans become part of Gods family?,क्या पापी इंसान परमेश्‍वर के परिवार के सदस्य बन सकते हैं?,8,11,3,अन्यायपूर्ण मानवों को भगवान परिवार में शामिल करने संभव है?,4.069582841,21.16917563,90.90909091
"After losing his son in an alleged fake encounter, Athar Mushtaqs father has been slapped with an FIR for demanding his dead body","महबूबा मुफ्ती ने ट्वीट किया, ‘कथित फर्जी मुठभेड़ में अपने बेटे अतहर मुश्ताक को खोने के बाद उसका शव मांगने को लेकर पिता पर एफआईआर दर्ज की गई है",23,29,6,"अतार मुस्तफ़quez पिता को गंभीर आरोपों से जेल में डाल दिया गया, जब उन्होंने अपनी पत्नी के निधन पर आधिकारिक रूप से झूठी हिंसक घटनाओं का खुलासा।",1.9458663,16.84169045,96.55172414
She had sustained serious injuries to her leg in the accident and is still undergoing treatment.,हादसे में वह बुरी तरह घायल हुआ है और उसका इलाज चल रहा है।,16,14,2,वह अभी भी घायल है और उसके पैर को ठीक करना जारी है।,7.193386833,24.1158517,78.57142857
"NMDC Ltd operates three iron ore complexes in the country, two of these are in Chhattisgarh while the third one in Karnataka.","एनएमडीसी लिमिटेड देश में तीन लौह अयस्क परिसरों का संचालन करती है और इनमें से दो छत्तीसगढ़ में, जबकि तीसरा कर्नाटक में है।",22,23,1,"एनएमडीसी लिमिटेड तीन कार्बन मिश्रित धातु परिवहन संचालन करता है, दो इन चतिसगढ़ और एक करणाटक में शामिल।",4.532641351,34.96104914,73.91304348
"Cains works were wicked, but those of his brother were righteous","कैन के “काम बुरे थे, और उसके भाई के काम धर्म के थे ”",11,14,3,"कैन्स के कामों में दुष्ट थे, लेकिन उनकी भाई का सही था।",6.299392144,22.25312606,85.71428571
"""The accused, it is reported, had also filed a complaint in the Punjab and Haryana High Court seeking justice in this connection.","""वहीं आरोपी ने खुद को नाबालिग बताकर पंजाब एंव हरियाणा हाईकोर्ट में अर्जी भी दायर की हुई है।",22,18,4,"असिस्टेड के बारे में यह जानकारी सामने आई है, और उन्होंने पंजाब और हरियाणा उच्च न्यायालय में एक शिकायत दायर करी, इस पर अदालत में निर्देशित करने के लिए।""",1.734561795,22.53292747,138.8888889
Nirav Modi fraud case: Sources said the CVC asked PNB officials to investigate how the irregularities went undetected for seven years given that audits were conducted each year.,PNB घोटाला: सीवीसी ने पूछा- नियमों के बावजूद कैसे हुआ घोटाला?,28,11,17,नीराव मोदी घोटाले केस: स्रोतों ने बताया कि एससीवीसी पब्लिक बैंक (पीबी) अधिकारियों पर निर्दोषता को छोड़ने वाले अंतर्निहित अपराधों को चेतावनी नहीं देने,1.65040456,19.71988527,209.0909091
AIMIM chief Asaduddin Owaisi told PTI that preliminary talks held between both parties have yielded positive results.,एआईएमआईएम प्रमख असदुद्दीन औवेसी ने बताया कि दोनों पार्टियों के बीच आरंभिक बातचीत में सकारात्मक परिणाम आए हैं.,17,18,1,अमीर मुस्लिम चीफ असदुद्दीन ओवाईसी पीटीआई के बीच पहले से हुए चर्चाों ने दोनों पक्षों पर सकारात्मक परिणाम उत्पन्न कर लिए हैं।,5.618923497,36.2695947,100
"Jehovah sent Haggai, 63 days after he had conveyed his second message, with a third proclamation that we can well take to heart today.","अपना दूसरा संदेश भेजने के ६३ दिन बाद, यहोवा ने हाग्गै को तीसरी उद्‌घोषणा के साथ भेजा जिसे आज हम भली - भाँति याद रख सकते हैं ।",24,28,4,"जहूएवा ने हाग्जाई को संदेश दिया, जिसकी पांच महीनों बाद उसने अपनी दूसरी मान्यता भेजी, और तीसरे आदेश को हमें आज लेने योग्य है।",2.01450713,25.93763832,100
"After that, click on the result link.",फिर रिजल्ट लिंक पर क्लिक करें।,7,6,1,अंततः क्लिक करें परिणाम लिंक पर।,9.652434877,45.44199711,100
"""The Directorate of State Council for Education Research and Training",शिक्षा अनुसंधान और प्रशिक्षण परिषद राज्य निदेशालय,10,7,3,"""राज्य सरकार के शिक्षा अनुसंधान और प्रशिक्षण पर दायरी""",24.808415,67.38121919,85.71428571
"After England stunned India in the first Test by 227 runs, the hosts made a grand comeback to win the second Test by a massive margin of 317 runs.","इंग्लैंड ने भारत को पहले मुकाबले में 227 रनों से मात दी थी, इसके बाद भारत ने इंग्लिश टीम को दूसरे टेस्ट मैच में 317 रनों से हराया था।",29,29,0,"अंतिम टेस्ट में इंग्लैंड ने भारत को पहला टेस्ट में 227 रनों से दूर खेलने पर सफलतापूर्वक जीत हासिल कर लिया। इस बार प्रत्येक गांधी और विशेष रूप से, अंतर्राष्ट्रीय",16.61865517,37.02395436,79.31034483
"""In electricity (electromagnetism), the electric susceptibility ( e . Latin: susceptibilis """"receptive"""") is a dimensionless proportionality constant that indicates the degree of polarization of a dielectric material in response to an applied electric field.""","विद्युतचुम्बकत्व के सन्दर्भ में, किसी परवैद्युत पदार्थ की वैद्युत प्रवृत्ति (electric susceptibility / संकेत χ e ) एक विमारहित राशि है जो यह दर्शाती है कि किसी वाह्य वैद्युत क्षेत्र में रखने पर वह पदार्थ कितना अधिक ध्रुवित होगा।",34,39,5,"अतिक्रमण की प्रक्रिया में एक संरक्षक (""Receptivity "") है, जो इलेक्ट्रोमैग्नेटिस्म में द्रव्यमानीय परिवर्तनशीलता के रूप में लेबल किया गया है। यह धातु यांत्रिक ऊर्जा,",1.566937253,16.33678217,92.30769231
Every person has value and importance.,हर भारतीय का मूल्य और महत्त्व है।,6,7,1,अपने जीवन में कोई भी व्यक्ति अपने स्वार्थ और महत्वपूर्णता पर आधारित होता है।,3.377156414,24.59530415,171.4285714
"Starting June 22, Deutsche Welle will offer four additional 24-hour TV channels for various parts of the world.",साथ ही डॉयचे वेले 22 जून के बाद भी चारों भाषाओं में प्रसारण जारी रखेगा.,18,15,3,सितंबर के शुरू में डचवेल सात दिनों तक चार और अधिक विशिष्ट टीवी चैनल प्रदान करेगा।,2.908317711,15.99648457,106.6666667
Our government works for the poor.,हमारी सरकार गरीबों के लिए काम कर रही है।,6,9,3,अपने सरकार को पीड़ित लोगों में से एक ही समय पर देना आवश्यक नहीं है।,3.125190764,20.63749131,144.4444444
